PID,비표_ID,C_Q1,C_Q1_1,C_Q1_2,C_Q2,C_Q3_1,C_Q3_2,C_Q3_3,C_Q3_4,C_Q3_5,C_Q3_6,C_Q4_1,C_Q4_2,C_Q4_3,C_Q4_4,C_Q4_5,C_Q4_6,C_Q4_7,C_Q4_8,C_Q5,C_Q6_1,C_Q6_2,C_Q6_3,C_Q6_4,C_Q6_5,C_Q6_6,C_Q6_7,C_Q6_8,C_Q6_9,C_Q6_10,C_Q7_1,C_Q7_2,C_Q8,C_Q9,C_Q10,C_Q11,C_Q12,C_Q13,C_Q14,C_Q15,C_DQ1,C_DQ2,C_DQ3,C_DQ4,C_DQ5,C_DQ6,D_Q1,D_Q1_1,D_Q1_2,D_Q2,D_Q3_1,D_Q3_2,D_Q3_3,D_Q3_4,D_Q3_5,D_Q3_6,D_Q4_1,D_Q4_2,D_Q4_3,D_Q4_4,D_Q4_5,D_Q4_6,D_Q4_7,D_Q4_8,D_Q5_1,D_Q5_2,D_Q5_3,D_Q5_4,D_Q5_5,D_Q5_6,D_Q5_7,D_Q5_8,D_Q5_9,D_Q5_10,D_Q6_1,D_Q6_2,D_Q7,D_Q8,D_Q9_M1,D_Q9_M2,D_Q9_1,D_Q10_M1,D_Q10_M2,D_Q10_1,D_Q11,D_Q12,D_Q13,D_Q14,D_Q15,D_Q16,D_Q17,D_Q18,D_Q19_1,D_Q19_2,D_Q19_3,D_Q19_4,D_Q19_5,D_Q19_6,D_Q19_7,D_Q19_8,D_Q20_1,D_Q20_2,D_Q20_3,D_Q20_4,D_Q20_5,D_Q20_6,D_Q20_7,D_Q20_8,D_Q20_9,D_Q20_10,D_Q20_11,D_Q20_12,D_Q20_13,D_Q20_14,D_Q21_1,D_Q21_2,D_Q21_3,D_Q21_4,D_Q21_5,D_Q22_1,D_Q22_2,D_Q22_3,D_Q22_4,D_Q22_5,D_Q22_6,D_Q23,D_Q23_1,WT4
1101005,307,3,,,3,2,1,1,2,2,2,2,1,2,3,4,2,1,2,1,4,1,4,2,6,5,5,3,7,1,4,2,4,2,2,5,4,1,4,3,3,3,3,8,1,5,2,,2.0,2,2,1,2,2,2,2,2,2,3,4,5,6,2,2,4,2,4,3,4,4,4,3,5,2,6,2,2,2,3,1.0,특이사항 없음,3,1.0,투명한 정보공개및 접근성 강화. 비리 근절및 안전불감증 일소,3,2,2,2,4,3,4,3,4,3,3,1,1,2,1,2,4,4,2,2,3,3,3,4,2,2,3,4,4,2,2,2,2,2,2,2,1,2,3,3,1,2,"토론형식의 부재, 공청회 같은   공론화 위원회. 공약실행을 위한 사전정지 작업인지 공약 파기를 위한 부담 떠넘기기인지 의심스러움",0.86
1101010,417,3,,,1,1,2,2,2,3,1,3,2,1,4,2,1,2,4,1,3,4,3,4,3,3,5,4,4,4,2,2,3,1,2,1,4,3,4,3,3,7,2,7,6,5,1,1.0,,1,1,2,4,3,3,2,3,2,4,5,4,5,2,2,3,4,2,4,4,4,5,4,3,4,2,3,1,2,1,2.0,,1,3.0,,3,1,2,1,4,3,4,3,6,6,5,2,3,2,3,3,3,2,1,1,2,2,3,4,1,1,3,4,5,2,2,2,2,1,2,1,1,3,4,3,3,2,,1.09
1101012,310,2,,2.0,2,1,1,1,2,1,4,3,2,3,2,3,2,1,3,3,3,2,6,2,6,3,6,2,7,1,7,2,3,2,2,1,2,3,3,3,3,7,4,7,8,5,2,,1.0,2,1,1,1,2,1,3,1,1,1,6,3,4,1,2,4,3,7,1,7,3,7,1,5,1,7,1,2,2,3,2.0,신재생에너지 정부지원의 투명화가 중요하다. 전력난과 전기요금인상에 대한 대책구비 인맥이나 당이 아닌 실리성으로만 진행되어야 한다,1,3.0,,3,4,2,1,4,3,4,3,3,6,3,3,4,4,6,4,4,4,1,1,1,1,1,4,1,1,7,2,3,2,3,2,2,4,4,1,1,1,4,3,1,2,일종의 사회적 실험으로서  성공적이었다고 생각함,0.86
1101035,32,1,4.0,,1,2,1,1,1,3,1,3,3,2,2,2,1,1,2,1,3,5,1,7,2,4,1,3,2,6,3,6,3,1,1,5,4,1,2,3,3,7,4,7,4,1,1,4.0,,2,1,1,1,1,2,2,1,3,6,4,4,4,2,2,4,4,2,7,3,5,3,4,1,5,1,1,1,1,4,2.0,주민이주문제 등 발색하는 모든 문제를 민주적 절차에 따라 처리하였으면 좋겠습니다,1,2.0,건설시공부터 가동중단까지 안전과 비리는 타협없이 운영했으면 좋겠습니다,3,4,2,2,4,1,2,3,3,5,3,1,2,1,1,1,1,1,1,1,1,1,1,3,5,3,2,2,2,6,1,1,1,1,1,1,2,2,1,1,1,3,"자료집, 이러닝 자료, 사회자,  모더레이터, 전반적인 공론화과정, 분임토의과정은 공정하였다고 생각하지만 뭔가 우 리의 생각을 틀안에 가둬 놓고 활발한 토론을 제한시켰다는 점에서 아쉬웠습니다",1.2
1101040,261,2,,2.0,3,2,1,1,4,1,2,2,2,2,3,3,2,2,4,3,6,3,3,4,6,2,5,2,7,1,4,2,4,4,2,5,4,5,2,5,3,3,2,7,3,5,2,,2.0,2,1,1,1,1,2,2,2,1,2,3,3,4,4,3,6,3,5,3,3,2,6,1,6,1,6,1,2,1,2,4.0,,4,3.0,,4,1,2,1,2,1,2,3,5,3,3,2,4,1,1,1,2,2,1,1,1,2,2,4,1,2,2,3,4,1,1,1,1,1,1,1,1,2,2,1,1,2,"아쉬운점이 있다면 질의응답시간외에 분임별로 패널분중 재개측 1분,반대측 1분을 따로 모셔서 직접질의 등 얘기를 나누었으면 좋았을것 같다",1.09
1101042,146,3,,,2,2,2,2,2,2,3,4,2,2,2,3,3,2,3,3,3,3,5,3,4,4,4,4,4,5,3,3,3,4,2,1,2,1,2,3,3,8,3,7,8,5,2,,4.0,2,2,1,2,2,2,3,3,2,2,2,5,6,2,2,3,3,6,3,5,3,3,2,3,3,2,2,2,2,3,1.0,"LNG발전 이외의 다른 에너지발전에 대한 연구,개발에 투자하고 태양광,풍력 등의 대체에너지에대한 규제가 완화,보완 되어야 한다",4,3.0,원전 운영에 대한 투명성과 안전한 운영에 대한 보완이 필요하고 비리 등에 의한 안전에 위협하는 것들에 대해 대비가 필요하다,3,1,4,2,2,1,4,3,2,3,4,3,3,1,1,1,4,4,2,2,2,4,3,6,2,2,3,4,5,2,2,1,2,2,3,1,2,2,2,2,1,2,중단과 재개의 입장에서 같은 사안에 대해서도 서로 다른 주장을 하는것이 '전문가의 강의'에서도 발생하였다.좀더 명확한 팩트 체크가 필요한것 같다.또한 각 입장에 대한 반박과 재반박 과정이 부족했다.그럼에도 이번 공론화 위원회는 개인적으로도 큰 의의가 있었고 이러한 시도 자체가 참신했고 좋았다.고생하신 모든 관계자 분들 수고 많으셨습니다!,1.09
1101068,336,3,,,2,1,2,2,2,2,1,4,4,4,3,2,2,2,4,5,5,4,4,3,3,4,3,3,5,3,4,3,4,4,2,4,4,1,2,3,3,5,3,7,5,1,2,,5.0,2,1,1,2,2,2,1,4,3,4,5,5,5,3,3,4,3,4,3,3,3,5,3,5,5,4,3,2,2,3,2.0,"중단할 경우 온실가스 등  미세 먼지, 일산화탄소 방출이 생기지 않는 자체적으로 신재생에너지 기술 개발에 힘써야한다",2,4.0,현재 30% 건설된 원전을 건설하 되 신재생에너지 개발과 투자에 힘을 써야 한다. 예를 들어 원전부지에 태양광 판넬을 설치하는 등 원전과 신재생에너지의 공존하는 방향으로 에너지 개발하였으면 한다,4,4,2,4,4,1,2,3,5,3,3,4,4,3,3,3,3,3,3,2,3,3,3,4,2,2,2,4,4,2,3,3,3,3,3,2,2,3,1,3,3,2,중단이냐 재개냐에 대한 공론화 보단 국민들을 나라 중대사에 참여할 수 있는 자리를 만들어 나라에 대한 애국심이나 관심을 이끌어 낸 것에 대해 큰 만족을 느낀다,1.2
1101082,254,3,,,1,2,2,3,4,5,2,4,4,3,4,5,3,4,3,4,4,2,2,6,5,3,3,5,5,4,2,2,3,4,2,5,2,1,4,3,3,4,2,7,4,3,3,,,1,2,3,4,5,4,2,4,3,5,2,3,6,3,3,2,3,2,5,4,3,3,4,4,3,2,2,2,1,1,3.0,"신재생에너지에대한 투자를 늘리고 국내산업에서 최대한 제작,유통,설치할수 있도록 기술개발",2,4.0,"원전은 신고리5,6호에서 끝내고 신재생 지원",3,1,2,2,4,3,4,3,4,6,2,3,3,1,2,1,2,2,1,1,2,4,3,3,2,2,2,3,3,2,3,1,2,1,2,1,1,2,2,2,1,2,"모든 사람의 의견을 들을수는 없으므로 이런식으로 시민들을 모아 의견을 듣는 공론화는 바람직하다고 본다. 전문가들은 자신의 이익과 직결된 문제일수 있어 공정한 결론이 나지 않을수 있으므로 제3자가 서로에게 의견을 듣고 결정하는 방식이 공정했다고 생각한다.불만족스러운 부분은 시간이 부족해 양측의 의견을 더 심도있게 듣고 질문하고 고민할 시간이 부족 했다는 것과 전문가들끼리의 반론,재반론이 부족했다고 생각되는 점 등이 있었다",1.09
1102003,288,3,,,2,2,1,2,4,2,2,3,2,2,2,3,2,3,2,1,4,5,4,4,5,4,5,3,5,3,5,4,3,1,5,4,4,1,4,3,3,7,3,5,7,5,2,,2.0,2,2,2,2,3,2,2,4,3,4,5,5,4,5,3,5,3,5,4,6,5,3,4,5,2,5,2,2,2,2,3.0,,3,4.0,,3,1,2,3,4,3,4,3,5,4,4,2,2,2,2,2,3,3,2,2,2,2,2,3,2,2,4,5,4,3,2,2,3,3,3,2,2,2,3,2,2,2,대체적으로 과정이 공정하게  진행되었다고 생각합니다,1.09
1102009,199,1,2.0,,1,1,2,2,3,2,2,3,3,2,1,4,1,1,2,2,3,5,5,5,2,3,3,4,3,2,3,3,3,4,2,1,2,5,3,3,3,7,2,5,7,5,1,4.0,,1,2,5,5,1,5,4,6,3,5,4,3,3,4,4,3,6,2,5,1,7,2,4,3,5,2,5,1,2,1,2.0,원자력기술을 버리지 말고  활용할 수 있는 다른 방법을 모색해봐야 함 (원전을 제외하고),4,2.0,원자력이 저렴하다고 조급하게  판단하지 말고 투명하게 핵폐기물처리비용 등을 후세에 넘기지 말고 지금 전기요금에 즉시 반영해야 함,3,1,2,4,4,1,4,3,6,3,3,2,2,3,2,2,2,2,2,2,2,2,2,3,2,2,2,3,2,2,1,2,3,3,3,1,1,2,1,3,1,2,대체로 만족되었지만 주변의  눈치를 보고 의견을 못낸 적도 있음(어르신들이 무섭게 재개쪽에 찬성하시고 원전으로  우리나라가 발전했다고 맹신하시기 때문에 감히 다른 의견을 내기가 어려울 때도 있었음) 하지만 국민들이 참여함으로써 준전문가가 된 사람도 많음 이런 과정을 많이 거치다보면 추후에 정책을 도입할 때 정치인&전문가(직접적 이해관계자)들은 국민의  의견을 묻고 더욱 투명하고 현명하게 정책도입을 할 수 있을 것 같음 분임토의를 토해 내 의견을 주장할 수 있고 (결정에 영향을 끼치는) 다른 정보들도 얻을 수 있었으며 모더레이터분의 전문적인 진행도 만족스러웠음,1.09
1102015,80,1,5.0,,1,1,1,2,2,2,1,1,1,1,1,3,1,1,3,1,3,6,4,6,1,3,1,5,4,5,2,3,2,4,4,3,4,3,3,3,3,99,9,9,9,9,1,5.0,,1,1,1,2,2,2,1,2,3,5,3,3,4,2,2,1,3,1,5,3,5,2,6,4,4,1,2,1,1,1,3.0,"기존 원전의 안전성을 보강하기 위한 수리,보수할 것 건설재개를 주장하던 사람들도 납득할 수 있을  '건설중단결정과정' 및 근거 공개와 설득작업,안정성있는 전력공급이 가능하다는 주장에 대한 근거와 자료를 마련->사회적설득작업,최근 일부산업전력이 직원들의 개인적인 비토코인을  만다는 과정에 사용됐죠 기업의 전력낭비를 막는 정책 꼭 필요합니다",2,4.0,노후원전수명연장하지말것  건설허가최소소송중인만큼 그에 대한 의혹해소작업 스스로 정당성 먼저 회복해야할 것,3,1,2,2,4,3,4,3,2,5,5,1,1,1,1,1,3,3,2,1,2,2,2,1,2,1,2,3,2,1,1,1,3,3,3,1,1,1,1,1,1,1,공론화위원회가 생기기 전부터  원전에 관심이 많았고 공론화위원회에서 시민참여단을 구성한다는 소식도 알고 있었습니다 그런 와중에 시민참여단으로 선정돼 무척 영광스러웠습니다 이 곳에 오기 전에  안일한 태도로 접해왔던 원전 및 에너지문제를 폭 넓고 깊게 숙의할 수 있었습니다 또한 나와 다른 사람들과 의견을 나누는 과정을 통해 더욱 성장할 수 있었습니다 따라서 매우 뜻깊은 시간이었고 매우 만족합니다 고생 많으셨습니다 고맙습니다,1.09
1102016,322,1,2.0,,2,1,2,2,3,3,2,5,5,3,3,5,2,5,4,4,2,6,3,5,2,3,2,6,6,6,1,2,5,5,5,5,3,5,3,5,3,3,4,7,4,1,1,1.0,,2,1,1,3,2,3,2,5,5,5,3,5,5,4,4,2,4,2,3,4,2,6,7,5,2,2,2,1,2,1,4.0,시민들이 안심할 수 있을 정도의 경제적인 가격의 신재생에너지가 빨리 개발되는 게 좋을 것 같다,2,1.0,우리나라는 기후적으로 신재생에너지를 지향하기에 적합하지 않다고 들었는데 건설을 재개하게 된다면 서둘러  신재생에너지개발에 힘써야 한다고 생각하고 그에 따른 정책과 경제적 측면에서도 확실한 대안이 있었으면 좋겠다,1,1,5,5,2,4,3,3,6,3,6,3,6,2,3,3,4,5,3,3,3,2,3,5,2,5,4,2,3,4,2,2,3,2,2,1,3,3,2,3,2,3,재개와 중단측 두 입장 중 어느 쪽 말을 믿어야 하는지 도저히 감이 안잡히고 최대한 설문조사를 꼼꼼히 임했기  때문에 정부가 어느 누군가 비리를 저지르거나 시민한테 숨기는 것 없이 바른 쪽으로 정책을 추진한다면 믿고 따를 것 같다,2.21
1102022,111,1,2.0,,1,1,2,5,3,5,1,3,4,3,4,3,3,2,5,1,2,7,2,6,1,5,1,7,3,5,1,6,3,1,2,4,4,3,4,3,3,5,2,5,2,5,1,2.0,,1,1,2,2,4,2,1,3,4,5,3,6,4,3,5,1,6,2,7,2,6,2,7,2,7,1,7,1,2,1,4.0,원전부지 주변 주민들에 대한 적절한 피해보상 현재 발전원의 전반적인 재정비를 통한 안정적인 전력수급 계획 수립,2,3.0,원자력 관련 정보를 투명하게 공개하고 한수원 등 관련 기업들의 적폐청산,3,1,2,2,4,3,4,3,5,3,2,2,2,1,1,2,2,2,1,1,1,3,2,3,2,2,3,5,3,2,1,1,2,1,1,1,1,2,2,1,1,2,국가가 국회의원과 자치단체  위원장이 아닌 국민들에게 의견을 묻고 수용하는 과정은 국민이 국회에 위임한 권한을  지켜나가는 방법이며 국가에 대한 국민의 신뢰를 찾아가는 방법이라고 생각합니다  이번 정부가 국민을 생각하고 대하는 철학을 잘 알고 체험하는 기회가 되었습니다,1.09
1102029,334,1,2.0,,1,1,2,1,2,2,1,3,1,1,2,3,2,1,1,1,2,6,2,6,2,5,2,7,2,6,1,6,3,1,2,2,2,3,4,3,3,6,2,7,4,5,1,2.0,,1,1,2,2,3,3,1,3,6,7,2,3,4,2,3,1,5,1,5,1,6,2,7,2,7,2,6,1,2,1,3.0,중단부지건설하기 위해 이주했던 사람들 지원,3,4.0,원전이 밀집된만큼 연쇄중단의  위험이 있기 때문에 일정거리안 원전의 안전관리기준안을 입법해야 한다,3,1,2,2,4,3,4,3,4,5,6,3,3,4,2,3,5,5,1,1,1,2,2,4,3,2,2,4,3,1,4,2,1,1,1,1,1,1,1,2,1,1,합숙을 통해 하나의 주제로 각각 다른 의견을 가진 사람들을 같은 자료로 교육하고 동일한 주제를 생각하고 있는 다른 사람들과 의견을 교환할 기회가 생기면서 더 많이 깊이 생각한 후에 최종결정을 내리는 방식이기 때문임,1.09
1102050,345,3,,,2,2,3,3,2,3,2,4,4,3,3,4,3,2,4,3,2,3,5,3,4,4,2,4,3,5,4,3,3,4,2,4,4,3,3,3,3,5,3,5,2,5,2,,2.0,1,2,2,3,3,4,3,5,3,3,3,4,4,3,4,3,3,4,3,4,4,3,3,4,5,4,3,2,1,1,2.0,전력이 남는다는 주장이 있는데 남지 않고 정전이 되어버린다면 추후 어떤 방법이 있는지 반대쪽에서 책임을 걸 수 있는지 환경에 도움이 된다는 친환경이 문제가 될 경우의 해결방안,3,1.0,"주민들의 대피소, 반대여론의 대처,주민의 안전성 관리,이번 5,6호기 이후에도 원전계획이 있는지 있다면 얼만큼의 전력비중을 둘 것인지 30%가 넘는데 더 추가가 될 경우 또 시민공론회를 만들 것인지",3,4,2,2,4,3,2,3,4,5,5,3,4,1,4,3,3,4,2,1,1,3,3,2,2,1,2,3,5,2,3,1,1,1,1,3,2,2,1,2,1,2,"전문가의 질문,답변 듣는 시간이 좀더 길게 적용됐으면 좋겟습니다 식사를 하는 부분에 인원을 정해 먼저 입장했으면 합니다 일정이 길었지만 내용토의가 충분히 되지 않아서 조금 더 시간이 필요합니다",2.21
1102067,192,2,,2.0,2,2,1,1,1,2,3,4,3,2,4,5,1,1,5,1,3,5,6,3,4,2,5,2,4,2,5,2,3,4,2,5,4,5,3,3,3,4,2,7,4,5,3,,,1,1,1,1,1,3,2,5,6,6,6,3,6,6,6,2,7,4,3,3,2,2,4,4,3,6,6,2,1,1,3.0,재생에너지를 원전처럼 실용적으로 활용하는 방안을 모색 후 경제성 안정성 환경성 다 추구한다,1,3.0,사익을 추구하는 것을 막는 제도를 더 강화 한다,3,4,2,4,4,1,3,3,4,1,4,1,2,2,2,2,5,4,1,1,3,2,5,3,6,6,3,4,4,4,2,1,1,1,1,1,2,2,2,3,1,3,1.시민 참여단을 구성해 국민의 생각을 나누는 '과정'만으로도 정치 사안에 관심을 갖게 되고 시민의식을 고취 시키는데에 큰 도움이 된다고 생각한다 2.양측이 '사실'이라고 주장하는 자료마저 서로 다르다. 이를 지켜 보면서 그들은 진정으로 국가를 위해 생각하는 것이 아니라 어디까지나 '이해관계' 속에 있다는 것을 느꼈다. 서로 각자의 주장만 펼치는건 토론이 아니다. 양측이 서로 대화하며 다른 주장을 서로 반론하거나 중립전문가가 나와서 이들의 주장과 자료를 팩트체크해 준다면 명쾌했을 것이다.토론 방식이 아쉽다. 내용 또한 자료집안 봐도 알 수 있는 얘기들의 반복이었다,0.89
1103001,79,1,1.0,,1,1,2,3,4,3,2,4,3,1,2,5,1,1,5,1,2,4,3,6,1,5,2,6,1,6,3,4,2,1,2,2,4,3,4,3,3,6,2,5,5,5,1,1.0,,1,1,2,3,4,4,2,4,4,4,3,5,4,2,4,2,3,2,6,2,6,2,6,2,6,2,3,1,2,1,3.0,"신고리 5,6호기를 비롯해 다수의 원자로가 모여있는 서생면 일대의 주민들에 대한 이주/생계 대책 지원. 이미 앞서 건설된 원자로들 때문에 다른 생계 방안을 찾기 힘들것으로 예상되기 때문이다",2,4.0,"추가 원전 건설계획 혹은 탈원전 여부에 대한 공론화 개최. 이번 공론화보다 더 개선되고 기간이 길게, 체계적으로 해야함",3,1,2,2,4,3,4,3,3,5,6,1,2,2,2,3,3,3,1,1,2,2,3,4,4,2,3,3,5,2,2,2,1,1,1,1,1,2,1,1,1,1,"일방적인 정책 결정이 아니라 대표성을 지닌 소수의 국민의 의견을 경청해 '깜깜이''묻지마'결정을 지양했기 때문이다. 다양한 지역/연령대의 시민들과 의견 교류를 함으로써 내가 다른 사람들과 비교해  어떤지를 다소나마 가늠할수 있는 기회가 되었다. 더불어, 국가 정책을 결정하는데 열심히 참여했다는 보람도 느낄수 있었다. 이러한 공론화 과정이 앞으로 더욱 개선/활발해 졌으면 좋겠다",0.98
1103002,331,2,,2.0,1,1,2,2,2,3,2,3,3,1,2,3,1,2,1,2,6,4,5,4,5,5,4,3,4,3,3,2,3,1,2,3,4,1,4,3,3,8,2,5,6,1,2,,1.0,1,1,2,2,3,2,2,4,2,5,4,4,4,3,3,5,4,4,4,6,4,5,2,5,2,3,2,2,2,1,3.0,LNG 발전 비중 확대는 동의할 수 없음. 신재생에너지를 최대한 빨리(2025년도까지) 확대해야 함.,4,1.0,구형 원전의 적기 퇴역(신재생에너지의 경제성이 증가됨에 따라),3,1,2,2,4,3,4,3,6,4,3,2,3,3,3,2,2,2,2,2,2,2,2,4,1,1,1,3,6,1,1,2,2,2,2,1,1,2,1,2,1,1,"직접민주주의에 해당하는 국민투표는 사회적 비용이 너무 크고 국회의원을 통한 대의민주주의는 국민들의 의견이 제대로 반영된다고 믿기 어렵다. 또한 국민투표 역시 대대수의 제대로 학습되지 않은 유권자들로 인해 올바른 결정이 이뤄진다고 보기 어려운데 이러한 공론화 과정을 통해 국 민들이 숙의를 통해 정책결정에 국민의 의견을 직접 반영할 수 있겠다는 점에서 공론 화 과정을 지지한다. 다만, 공론화 토론과정에서 준비부족으로 자료집의 검증이 부족 한 점이나 참여국민의 수가 500명으로 전체 국민수 대비 너무 적다는 점은 차후에 법 제화를 통해 보완되었으면 하는 바이다.",1.02
1103007,423,1,1.0,,1,1,2,2,1,2,1,1,1,1,3,1,1,1,3,1,2,6,2,6,1,7,2,6,1,6,1,6,3,4,2,3,2,1,4,5,3,6,2,5,5,5,1,1.0,,1,1,1,4,1,3,1,4,6,6,1,3,2,6,1,1,5,2,6,1,6,1,6,1,6,1,6,1,1,1,4.0,해당 기업과 공기업에 대한 보상보다 우선 그 지역 주민들에게 양해를 반드시 얻고 적정한 보상이 꼭 이루어져야 한다. 해당 지역 위주의 충분한 합의와 보상,1,4.0,원전사업과 기득권과의 연결고리를 끊어야 한다(원전비리에 대한 엄중한 처벌과 원전사고 은폐에 대한 엄중한 처벌),3,4,2,3,2,1,4,2,3,5,5,3,2,2,2,2,3,3,2,2,2,2,2,3,2,2,3,4,5,2,4,1,2,2,1,1,2,2,1,1,1,1,랜덤(RANDOM) 방식으로 추첨된  시민들이 한 자리에 모여서 공론화 방식을 걸쳐 의견을 수렴한다는 것은 전에 없던 시민들의 의견들을 수용하는 방식이므로 결과를 떠나서 시도를 했고 시행했다는 점에서 민의주의 방식에 맞다고 생각하기 때문이다. 첫 시도를 했다는 점에서 매우 만족한다,0.98
1103017,19,2,,4.0,3,1,1,2,1,3,1,1,2,1,1,1,2,1,3,2,7,1,7,1,5,1,3,4,7,1,7,1,3,4,2,1,4,1,3,3,2,4,3,5,2,5,2,,4.0,3,1,1,1,1,3,1,3,1,1,2,3,5,1,4,5,2,6,6,4,1,4,1,7,1,5,1,2,1,2,1.0,대기업이 달려들 경우  중소기업들은 힘들어집니다 거기에 대한 방안,3,1.0,핵생들 그리고 시민들이  신청하면 견학을 해야 합니다,3,1,2,1,4,1,2,3,2,3,4,2,3,3,3,1,3,2,2,3,1,2,2,3,1,3,2,1,4,1,1,1,1,1,1,1,1,1,1,2,1,1,처음 참여했습니다 나의 의견과 내가 모른 정보를 알 수 있고 토의할 수 있어서 좋았습니다,1.02
1103018,234,3,,,1,1,1,1,3,2,2,1,2,3,3,3,3,2,3,2,3,4,4,3,1,5,3,2,3,4,3,4,3,1,1,2,4,3,4,3,3,6,4,5,6,3,3,,,1,1,1,2,2,2,2,2,3,4,4,3,4,4,4,3,4,5,3,3,4,3,3,4,3,3,2,2,1,1,2.0,"1.폐로예정인 고리 2,3,4원전의 안정성 확보하여 연장운영을 위해 노력하여 에너지부족사태에 대비 2.신재생에너지로 인한 환경문제,보상문제 등 발생할 수 있는 상황에 대해서도 비중있게 대비",4,2.0,안전성확보를 위해 대통령 직속 산하기구를 만들어 투명한 감시가 가능토록 한다,3,1,2,2,4,3,4,3,5,4,3,2,2,2,2,1,2,2,2,1,2,2,2,2,2,2,2,3,3,2,2,2,2,1,1,1,1,1,1,2,1,1,"1.정부가 독단적으로 결정하지  않고 한번 더 국민의 의사를 들어보고자 노력한 점 2.위원회가 되도록 공정하고  중립적으로 진행한 점 3.찬,반 극단적인 선택만이 아닌 대안이나 절충안에 대해서도 논의한 점 4.질의응답을 듣고 납득하지 못하거나 의무이 있는 경우 국가질문을 할 수 없어서 아쉬움",1.19
1103023,144,1,4.0,,1,2,4,4,5,5,2,1,2,2,3,2,1,1,2,1,3,3,2,4,1,3,3,5,4,3,1,3,3,4,2,3,4,3,2,3,2,2,2,6,3,5,1,4.0,,1,1,3,3,2,3,1,3,4,5,3,3,4,4,4,1,3,2,4,1,5,2,4,3,4,2,4,1,2,1,2.0,건설지역 주민에 대한 보상,4,2.0,"원전에 관련된 모든 내용을 공개하고 투명하게 유지, 관리해야 한다",3,1,2,3,4,3,3,3,7,3,1,3,3,3,4,2,4,3,1,1,2,3,3,2,2,2,2,4,4,2,3,2,2,1,1,1,1,3,2,2,1,2,분임토의시 공간이 부족해서  다른 분임들 소리에 많이 집중하기 어려웠다. 식사시 한번에 내려가서 기다리는 시간이 많이 불편했다. 전문가들의 견해가 많이 상반되어서 약간 신뢰가 떨어지는 부분이 많았다,0.98
1103033,381,2,,3.0,1,1,2,2,2,3,2,1,1,1,1,1,1,1,2,1,6,2,3,5,7,3,4,3,5,3,3,2,3,1,2,1,4,1,4,3,3,9,2,5,8,3,3,,,1,2,1,1,3,3,2,2,3,4,5,2,2,4,5,4,3,4,7,5,3,2,4,2,2,4,3,2,2,1,2.0,탈원전은 지양하고 원전 비중을 다시 감축시킬 필요가 있음(20~25%) 나머지 감축된 발전량만큼은 재생에너지 및  에너지관리기능 강화 (smart 수소반응 분산 peak-cut),2,4.0,"8차 전력수급- 수요 예측후 잠정중단후 향후 재개도 가능하다면 그렇게. 건설과정에 시민단체 의견 반영(모니터링, 자료 제공, 감시기능 강화 등)",3,1,2,1,4,1,4,3,3,6,3,2,1,1,2,2,5,4,3,2,4,2,2,3,4,2,4,2,1,3,3,2,3,2,2,1,2,2,3,2,2,3,공론화취지는 좋으나 운영방식이 미흡함 개선을 통해 향후 보완된 공론화 기대 1.분임토의시 의견교환 자유토론필요 2.전문가패널->이해관계자배제 (원전운영사 환경단체 애널리스트 이익집단(협회)) 충분히 배제가능 3.공론화 본과정 진행 전 전문가패널간 토론을 통해 공론화과정에서 주제토론에 대한 이슈범위를 좁혀서 참여단 판단이 가능하게끔(금번 토론은 이슈범위가 포괄적이라 건설재개/중단과 무관한 내용도 많았고 정확한 판단이 불가함),1.02
1103048,488,2,,2.0,2,1,1,2,2,2,1,2,2,2,3,4,1,1,3,1,4,4,4,3,3,2,1,3,4,3,3,2,3,1,2,1,4,3,4,3,2,3,3,2,5,1,2,,2.0,2,1,1,1,1,1,1,2,1,2,4,4,4,2,3,2,2,3,2,5,2,4,5,6,4,3,1,2,2,1,3.0,원전수출 및 원자력 기술력은 우리나리의 소중한 재산이므로 원자력 기술이 사장되지 않도록 충분한 지원이 있어야 한다.,3,4.0,원전의 안전기준을 강화하고 원 전 근처 주민들에게 충분한 보상이 있어야 한다. 원전 외 다른 전력공급도 균형 있게 발전시켜야 할 때이다.,3,1,2,2,2,3,4,3,3,3,2,3,2,1,3,2,3,3,1,1,1,2,2,2,2,1,1,4,4,1,3,3,1,2,1,1,1,1,1,1,1,1,"원자력 및 신재생에너지에 대하 여 새로운 사실들을 많이 알았고 공기, 물처럼 전기도 너무나도 소중한 에너지인데 소중함을 잊고 살았던 것 같고 공론화를 거치면서 우리나라 시민의식이 상당히 높은 수 준인 것을 체감했습니다.",1.02
1103064,6,2,,2.0,2,1,1,2,6,2,1,5,4,3,3,5,1,1,1,1,6,4,7,3,7,6,4,2,4,1,5,3,3,4,2,5,2,1,3,3,3,7,2,5,3,1,2,,2.0,1,1,1,2,4,3,1,3,2,4,4,6,6,2,2,5,3,6,2,5,4,6,2,3,1,3,2,2,1,1,2.0,한수원은 사업 영속성을 위해 신재생에너지 사업을 시작해야 한다,4,3.0,전력 수급계획 수립시 신재생 에너지 비중을 확대,3,1,2,5,4,3,3,3,3,3,6,2,3,2,2,2,2,2,1,1,1,3,1,7,2,1,2,6,7,2,3,3,3,3,2,2,1,2,1,1,1,1,한가지 이슈에 대해 학습하고 다양한 의견을 듣고 다른 의견을 지닌 일반인과 만날수 있어서,0.98
1104011,223,2,,2.0,2,1,1,2,2,2,2,2,1,2,2,2,1,1,1,1,5,3,5,3,7,3,6,1,7,2,4,3,3,1,2,2,2,4,4,3,3,6,2,5,6,3,2,,2.0,2,1,1,2,2,2,2,2,2,3,4,4,5,2,2,7,3,5,3,7,2,5,1,4,3,6,2,2,2,2,3.0,원자력 발전소의 supply chain이 무너지지 않도록 지속적인 지원/관리 필요,3,1.0,국민들의 심리적 불안감 해소를 위해 투명한 운영이 필요(너무 많은 거짓뉴스에 대한 의혹 해소),3,1,2,2,4,4,4,3,3,6,6,2,2,2,2,2,3,3,3,2,4,2,2,2,2,1,2,3,3,2,2,2,3,3,2,1,1,1,2,3,1,3,저는 공론화 위원회를 믿습니다. 다만..시민참여단분들 중 일부가 중단측 시민단체 패널에 줄서서 사인받는 모습을 봤습니다..의심을 했었지만 확인 할수가 없었네요.,1.29
1104012,243,2,,2.0,1,2,2,2,2,2,2,2,2,3,2,2,1,1,4,1,3,6,5,2,4,6,4,3,2,5,4,4,3,4,5,5,2,3,3,3,3,5,3,5,4,5,3,,,1,2,2,2,1,2,2,3,6,7,9,4,4,4,6,3,5,3,5,3,5,4,4,3,5,4,5,1,2,1,3.0,,2,1.0,유럽형 원전(이중격납)으로 업그레이드,3,1,2,2,2,3,3,3,4,4,4,3,4,3,3,3,6,6,2,2,2,2,2,2,2,2,3,4,3,2,3,3,3,3,3,2,2,2,2,2,2,3,"공론화자료집의 찬반측 주장을  점검하고 잘못된 혹은 과장된 내용을 수정한 뒤 시민에게 배포하는 것이 옳다고  생각한다 찬반 모두 공론화에서 본인들에게 유리한 말만 한다 전문가가 아닌 일반인들은  이를 걸러들어야 하는 수고로움이 있고 찬,반측 어느 한쪽으로 반론을 제기하지 않는  이상 잘못된 정보를 사실로 받아들일 우려가 있다 즉 시민참여단이 잘못된 결정을   내린다면 그것은 이러한 자료집과 이러닝수업,과장된 정보를 제공한 패널들의 잘못일 것이다",1.17
1104017,216,1,2.0,,1,1,2,2,2,2,2,3,2,2,5,3,1,1,3,1,3,4,3,6,2,6,3,5,3,3,2,3,3,1,2,5,4,3,4,3,3,5,2,6,7,5,1,1.0,,1,1,2,2,2,2,2,2,3,3,3,4,4,3,3,2,4,2,5,1,4,3,3,2,3,1,3,1,1,1,3.0,기술 및 자원을 원전해체기술 개발에도 투자를 해야한다고 생각합니다.,1,4.0,,3,1,2,2,4,3,4,3,4,4,4,4,4,3,3,3,4,4,3,1,3,1,2,2,2,2,4,4,4,2,4,1,3,1,1,1,2,3,2,1,1,2,"과정과 포맷은 숙의민주주의의  실현으로 굉장히 만족합니다. 다만 내용면에서 양측의 주장이 매우 상이하여 비전문가의 입장에서 판단하기가 쉽지 않았습니다. 객관적 인사가 양측의 주장이 상이한 이유, 근거 및 배경을 설명해 주었더라면 하는 아쉬움이 남습니다.",0.86
